{
  "schema_version": 1,
  "base_sha": "aaaaaaaaaaaaaaaaaaaaaaaaaaaaaaaaaaaaaaaa",
  "head_sha": "bbbbbbbbbbbbbbbbbbbbbbbbbbbbbbbbbbbbbbbb",
  "brief_digest": "3aab50ac2fa74c0cceccdca0226067152880096f2d6a925175863f6cb03436d1",
  "reviewer": {
    "identity": "reviewer-seat-opus-5",
    "role": "reviewer-seat"
  },
  "reviewed_at": "2026-08-13T09:30:00+00:00",
  "axes": {
    "standards": {
      "status": "approve",
      "findings": []
    },
    "spec": {
      "status": "approve",
      "findings": []
    }
  },
  "ac_to_test": [
    { "ac_id": "AC1", "test_type": "unit", "test_path": "scripts/local-gates/review-verdict.test.sh" },
    { "ac_id": "AC2", "test_type": "integration", "test_path": "scripts/local-gates/review-verdict.test.sh" },
    { "ac_id": "AC3", "test_type": "unit", "test_path": "scripts/local-gates/review-gate-docs.test.sh" },
    { "ac_id": "AC4", "test_type": "api", "test_path": "scripts/local-gates/pr-review-check.test.sh" },
    { "ac_id": "AC5", "test_type": "api", "test_path": "scripts/local-gates/pr-review-check.test.sh" },
    { "ac_id": "AC6", "test_type": "integration", "test_path": "scripts/local-gates/pr-review-check.test.sh" }
  ],
  "ac_total": 6,
  "repair_evidence": { "mode": "local-deterministic-harness" },
  "gate_evidence": [
    { "command": "shellcheck scripts/local-gates/*.sh scripts/local-gates/*.test.sh", "exit": 0, "evidence": "no warnings under --severity=warning" },
    { "command": "ruff check scripts/local-gates/", "exit": 0, "evidence": "E/W/F/I/B/C4/UP/C90/S clean" },
    { "command": "bash scripts/local-gates/review-verdict.test.sh", "exit": 0, "evidence": "schema + axis + head-invalidation probes green" },
    { "command": "bash scripts/local-gates/pr-review-check.test.sh", "exit": 0, "evidence": "threads/findings/ack staleness + AC6 flow green" },
    { "command": "bash scripts/local-gates/review-gate-docs.test.sh", "exit": 0, "evidence": "single-source guidance assertion green" }
  ],
  "mutation_evidence": [
    { "probe": "schema validation", "mutation": "dropped head_sha field check", "red": true, "restore": true, "green": true },
    { "probe": "axis rejection", "mutation": "gate approves when spec rejects", "red": true, "restore": true, "green": true },
    { "probe": "head invalidation", "mutation": "gate ignores head_sha mismatch", "red": true, "restore": true, "green": true },
    { "probe": "findings-snapshot invalidation", "mutation": "ack ignores snapshot", "red": true, "restore": true, "green": true },
    { "probe": "authorized acknowledgement", "mutation": "ack counts bot self-dismissal", "red": true, "restore": true, "green": true }
  ]
}
